{
  "kind": "validation-report",
  "schemaVersion": "1.0.0",
  "jobId": "enemy-mob-32-weirkeeper-frogling",
  "status": "passed-with-warnings",
  "checks": [
    {
      "code": "structural-validation",
      "level": "warning",
      "status": "warning",
      "message": "Submission validated with minor advisory warnings."
    }
  ],
  "createdAt": "2026-08-02T02:50:54.000Z"
}
