{
  "kind": "validation-report",
  "schemaVersion": "1.0.0",
  "jobId": "enemy-mob-32-black-cart-tinker",
  "status": "passed",
  "checks": [
    {
      "code": "structural-validation",
      "level": "info",
      "status": "passed",
      "message": "Submission structural validation passed clean."
    }
  ],
  "createdAt": "2026-08-01T23:22:24.388Z"
}
