{
  "kind": "validation-report",
  "schemaVersion": "1.0.0",
  "jobId": "enemy-mob-32-bramblejaw-boar",
  "status": "passed",
  "checks": [
    {
      "code": "preflight-passed",
      "level": "info",
      "status": "passed",
      "message": "Preflight submission validation passed clean."
    }
  ],
  "createdAt": "2026-08-01T21:02:57.873Z"
}
