{
  "kind": "validation-report",
  "schemaVersion": "1.0.0",
  "jobId": "enemy-mob-32-thimblecap-bogle",
  "status": "passed-with-warnings",
  "checks": [
    {
      "code": "structural-validation",
      "level": "warning",
      "status": "warning",
      "message": "Submission validated with advisory warnings."
    }
  ],
  "createdAt": "2026-08-01T13:17:42.000Z"
}
