{
  "kind": "validation-report",
  "schemaVersion": "1.0.0",
  "jobId": "enemy-mob-32-molten-pikeguard",
  "status": "passed-with-warnings",
  "checks": [
    {
      "code": "structural-validation",
      "level": "warning",
      "status": "warning",
      "message": "Submission validated with advisory cell boundary contact warnings."
    }
  ],
  "createdAt": "2026-08-01T21:52:06.303Z"
}
