{
  "kind": "validation-report",
  "schemaVersion": "1.0.0",
  "jobId": "enemy-mob-32-gravecloth-wanderer",
  "status": "passed-with-warnings",
  "checks": [
    {
      "code": "structural-validation",
      "level": "warning",
      "status": "warning",
      "message": "Submission validated with advisory boundary contact warnings."
    }
  ],
  "createdAt": "2026-08-01T10:26:35.935Z"
}
