{
  "kind": "validation-report",
  "schemaVersion": "1.0.0",
  "jobId": "enemy-mob-32-crossbow-sentry",
  "status": "passed-with-warnings",
  "checks": [
    {
      "code": "sheet-dimensions",
      "level": "info",
      "status": "passed",
      "message": "The sheet is 320x128 with 32x32 cells."
    },
    {
      "code": "vertical-slice-layout",
      "level": "info",
      "status": "passed",
      "message": "Idle, walk, and attack occupy 10 columns across four direction rows."
    },
    {
      "code": "duplicate-frames",
      "level": "warning",
      "status": "warning",
      "message": "Attack column 6 duplicates walk column 2 in some rows."
    }
  ],
  "createdAt": "2026-08-01T11:07:20.000Z"
}
