{
  "kind": "validation-report",
  "schemaVersion": "1.0.0",
  "jobId": "enemy-mob-32-spellroot-mandrake",
  "status": "passed",
  "checks": [
    {
      "code": "sheet-dimensions",
      "level": "info",
      "status": "passed",
      "message": "The sheet is 320x128 with 32x32 cells."
    },
    {
      "code": "vertical-slice-layout",
      "level": "info",
      "status": "passed",
      "message": "Idle, walk, and attack occupy 10 columns across four direction rows."
    },
    {
      "code": "source-artifact",
      "level": "info",
      "status": "passed",
      "message": "Aseprite source matches sheet.png and layer contracts."
    }
  ],
  "createdAt": "2026-08-01T08:43:55.229Z"
}
