{
  "kind": "validation-report",
  "schemaVersion": "1.0.0",
  "jobId": "enemy-mob-32-glyphwing-moth",
  "status": "passed-with-warnings",
  "checks": [
    {
      "code": "structural-validation",
      "level": "warning",
      "status": "warning",
      "message": "Submission validated with advisory duplicate frame and boundary contact warnings."
    }
  ],
  "createdAt": "2026-08-01T04:21:52.000Z"
}
