{
  "kind": "validation-report",
  "schemaVersion": "1.0.0",
  "jobId": "enemy-mob-32-bellcap-juggler",
  "status": "passed",
  "checks": [
    {
      "code": "structural-validation",
      "level": "info",
      "status": "passed",
      "message": "Submission validated cleanly."
    }
  ],
  "createdAt": "2026-08-02T02:03:26.245649Z"
}
