{
  "kind": "validation-report",
  "schemaVersion": "1.0.0",
  "jobId": "enemy-mob-32-ragbanner-skeleton",
  "status": "passed-with-warnings",
  "checks": [
    {
      "code": "structural-validation",
      "level": "warning",
      "status": "warning",
      "message": "Submission passed technical validation with advisory warnings."
    }
  ],
  "createdAt": "2026-08-02T15:14:47.726Z"
}
