{
  "kind": "validation-report",
  "schemaVersion": "1.0.0",
  "jobId": "anvilkin-porter",
  "status": "passed-with-warnings",
  "checks": [
    {
      "code": "structural-validation",
      "level": "warning",
      "status": "warning",
      "message": "Submission validated with advisory duplicate frame warnings."
    }
  ],
  "createdAt": "2026-08-01T21:44:15Z"
}
