{
  "kind": "validation-report",
  "schemaVersion": "1.0.0",
  "jobId": "enemy-mob-32-petalwing-wasp",
  "status": "passed-with-warnings",
  "checks": [
    {
      "code": "structural-validation",
      "level": "warning",
      "status": "warning",
      "message": "Submission validated with advisory duplicate frame warnings on pre-attack posture."
    }
  ],
  "createdAt": "2026-07-31T16:24:30.682Z"
}
