{
  "kind": "validation-report",
  "schemaVersion": "1.0.0",
  "jobId": "enemy-mob-32-razorbeak-hawk",
  "status": "passed",
  "checks": [
    {
      "code": "structural-validation",
      "level": "info",
      "status": "passed",
      "message": "Submission validated cleanly."
    }
  ],
  "createdAt": "2026-08-02T21:34:25.000Z"
}
